Nombre,Descripción,Tipo de Dato
MOSTRAR_OBSERVACION_EN,Muestra lugar en el que se muestra la observación,Varchar
ID_CONTRATO,Identificador unico del contrato,Integer
ORIGEN,Muestra el Módulo en el cual se agregó observación,Varchar
ID_USUARIO,Identificador único del usuario,Integer
ESTADO_CONTRATO,Estado del contrato,Varchar
FECHA_REGISTRO,Fecha en la que se registró la observación,Date Time
ELIMINADO,Muestra si la observación está eliminada,TinyInt
OBSERVACION,Observación del contrato,Text
ID_CONTRATO_OBSERVACION,Identificador del ingreso del cliente,Integer